book_id,title,authors,average_rating,isbn,isbn13,language_code,num_pages,ratings_count,text_reviews_count,publication_date,publisher,author
2051,"The Simple Art of Murder","Raymond Chandler",4.16,0394757653,9780394757650,eng,384,4952,162,1988-09-12,"Vintage Crime/Black Lizard","Raymond Chandler"
2052,"The Big Sleep (Philip Marlowe #1)","Raymond Chandler",4.01,0394758285,9780394758282,eng,231,103400,4076,1988-07-12,"Vintage Crime","Raymond Chandler"
2054,"The Long Goodbye (Philip Marlowe #6)","Raymond Chandler",4.22,0394757688,9780394757681,eng,379,26389,1619,1988-08-12,"Vintage Crime/Black Lizard","Raymond Chandler"
2056,"An Evening of Long Goodbyes","Paul Murray",3.6,0812970403,9780812970401,eng,448,983,130,2005-09-13,"Random House Trade Paperbacks","Paul Murray"
2057,"The Long Goodbye: Memories of My Father","Patti Davis",3.82,0452286875,9780452286870,eng,205,214,31,2005-10-01,"Plume Books","Patti Davis"
2058,"Ghost In the Shell 2: Innocence: After the Long Goodbye","Masaki Yamada/Yuji Oniki/Carl Gustav Horn",3.97,1421501562,9781421501567,eng,196,250,12,2005-10-11,"VIZ Media LLC","Masaki Yamada"
2059,"The Long Goodbye (Philip Marlowe #6)","Raymond Chandler",4.22,056352474X,9780563524748,eng,2,10,2,2004-09-20,"BBC Worldwide","Raymond Chandler"
2067,"Breaking the Spell: Religion as a Natural Phenomenon","Daniel C. Dennett",3.89,067003472X,9780670034727,eng,448,10135,330,2006-02-24,"Viking Books","Daniel C. Dennett"
2068,"Darwin's Dangerous Idea: Evolution and the Meanings of Life","Daniel C. Dennett",4.04,068482471X,9780684824710,eng,588,13563,235,1996-06-12,"Simon Schuster","Daniel C. Dennett"
2071,"Freedom Evolves","Daniel C. Dennett",3.83,0142003840,9780142003848,eng,368,2324,88,2004-01-27,Penguin,"Daniel C. Dennett"
2072,"Brainstorms: Philosophical Essays on Mind and Psychology","Daniel C. Dennett",3.95,0262540371,9780262540377,eng,424,573,11,1981-07-13,"MIT Press","Daniel C. Dennett"
2074,"Kinds of Minds: Towards an Understanding of Consciousness","Daniel C. Dennett",3.82,0465073514,9780465073511,eng,192,1555,63,1997-06-12,"Basic Books","Daniel C. Dennett"
2077,"Leaps of Faith: Science Miracles & the Search for Supernatural Consolation","Nicholas Humphrey/Daniel C. Dennett",3.61,0387987207,9780387987200,eng,244,21,3,1999-06-04,"Copernicus Books","Nicholas Humphrey"
2078,"Elbow Room: The Varieties of Free Will Worth Wanting","Daniel C. Dennett",3.92,0262540428,9780262540421,eng,212,515,37,1984-11-21,"MIT Press","Daniel C. Dennett"
2081,"The Mind’s I: Fantasies and Reflections on Self and Soul","Douglas R. Hofstadter/Daniel C. Dennett",4.14,0553345842,9780553345841,eng,512,4786,92,1985-04-01,"Bantam Books","Douglas R. Hofstadter"
2093,"The Illustrated A Brief History of Time","Stephen Hawking",4.17,0553103741,9780553103748,eng,256,817,63,1996-11-01,"Bantam Books","Stephen Hawking"
2094,"A Briefer History of Time","Stephen Hawking/Leonard Mlodinow",4.22,0553804367,9780553804362,eng,176,24035,828,2005-09-27,Bantam,"Stephen Hawking"
2095,"The Universe in a Nutshell","Stephen Hawking",4.15,055380202X,9780553802023,eng,216,29607,645,2001-11-06,Bantam,"Stephen Hawking"
2096,"God Created the Integers: The Mathematical Breakthroughs That Changed History","Stephen Hawking",4.07,0762419229,9780762419227,eng,1160,1682,51,2005-10-04,"Running Press Book Publishers","Stephen Hawking"
2099,"Stephen Hawking's Universe: The Cosmos Explained","David Filkin/Stephen Hawking",4.29,0465081983,9780465081981,eng,304,1469,22,1998-10-09,"Basic Books","David Filkin"
2100,"The Future of Spacetime","Stephen Hawking/Kip S. Thorne/Igor Novikov/Timothy Ferris/Alan Lightman/Richard Price",3.94,039332446X,9780393324464,eng,224,257,10,2003-06-17,"W. W. Norton Company","Stephen Hawking"
2102,"Stephen Hawking's Universe","John Boslough",4.02,0380707632,9780380707638,eng,160,674,30,1989-06-01,Avon,"John Boslough"
2103,"The Nature of Space and Time","Stephen Hawking/Roger Penrose",4.09,0691050848,9780691050843,eng,152,989,40,2000-10-08,"Princeton University Press","Stephen Hawking"
2104,"The Physics of Star Trek","Lawrence M. Krauss/Stephen Hawking",3.83,0060977108,9780060977108,eng,188,4774,178,1996-08-16,ReganBooks,"Lawrence M. Krauss"
2107,"Falconry & Hawking","Phillip Glasier",4.31,0713484071,9780713484076,eng,352,51,5,2006-02-01,Batsford,"Phillip Glasier"
2109,"The World Treasury of Physics Astronomy & Mathematics from Albert Einstein to Stephen W. Hawking & from Annie Dillard to John Updike","Timothy Ferris",4.13,0316281336,9780316281331,eng,859,371,12,1993-06-30,"Back Bay Books","Timothy Ferris"
2112,"The Art of Nonfiction: A Guide for Writers and Readers","Ayn Rand/Robert Mayhew/Peter Schwartz",3.96,0452282314,9780452282315,eng,192,429,39,2001-02-01,"New American Library","Ayn Rand"
2113,"The Journals of Ayn Rand","Ayn Rand/Leonard Peikoff/David Harriman",3.94,0452278872,9780452278875,eng,752,317,14,1999-08-01,NAL,"Ayn Rand"
2122,"The Fountainhead","Ayn Rand/Leonard Peikoff",3.87,0451191153,9780451191151,eng,704,271754,10063,1996-09-01,"Signet Book","Ayn Rand"
2123,"The 36-Hour Day: A Family Guide to Caring for Persons with Alzheimer Disease Related Dementing Illnesses and Memory Loss in Later Life","Nancy L. Mace/Peter V. Rabins",4.24,0446618764,9780446618762,eng,624,69,6,2006-11-01,"Grand Central Life & Style","Nancy L. Mace"
2126,"The 3-Hour Diet: On the Go","Jorge Cruise",3.1,0060793198,9780060793197,eng,192,31,2,2005-10-18,"William Morrow Paperbacks","Jorge Cruise"
2127,"The Last Hours of Ancient Sunlight: The Fate of the World and What We Can Do Before It's Too Late","Thom Hartmann/Joseph Chilton Pearce/Neale Donald Walsch",4.23,1400051576,9781400051571,eng,400,1392,136,2004-04-27,"Broadway Books","Thom Hartmann"
2136,"Specimen Days","Michael Cunningham",3.58,0312425023,9780312425029,eng,336,4462,446,2006-04-18,"Picador USA","Michael Cunningham"
2137,"A Home at the End of the World","Michael Cunningham",3.91,0312424086,9780312424084,eng,342,14769,658,2004-07-01,Picador,"Michael Cunningham"
2140,"Blink: The Power of Thinking Without Thinking","Malcolm Gladwell",3.93,0316172324,9780316172325,eng,277,4254,355,2005-01-11,"Little Brown and Company","Malcolm Gladwell"
2142,Blink,"Ted Dekker",4.17,0849945119,9780849945113,eng,400,13334,502,2004-10-11,"Thomas Nelson","Ted Dekker"
2144,"Blink-182: Tales from Beneath Your Mom","Mark Hoppus/Anne Hoppus/Alex Gaskarth",4.39,0743422074,9780743422079,eng,112,169,22,2001-10-02,"MTV Books","Mark Hoppus"
2151,"The Complete Novels","Jane Austen/Hugh Thomson",4.55,0517147688,9780517147689,eng,1103,300,31,1995-09-03,"Gramercy Books","Jane Austen"
2152,"The Jane Austen Book Club","Karen Joy Fowler",3.08,0452286530,9780452286535,eng,288,57720,3535,2005-04-26,"G.P. Putnam's Sons","Karen Joy Fowler"
2153,"Jane Austen: The Complete Novels","Jane Austen",4.55,0517118297,9780517118290,eng,1103,267,24,1994-06-01,"Gramercy Books","Jane Austen"
2155,"Jane Austen's Letters","Jane Austen/Deirdre Le Faye",4.16,0192832972,9780192832979,eng,672,2278,69,1997-04-03,"Oxford University Press USA","Jane Austen"
2156,Persuasion,"Jane Austen/James Kinsley/Anna Massey/Richard S. Hartmetz/Maurgaux Motin/Deidre Shauna Lynch",4.14,0192802631,9780192802637,eng,249,441462,11308,2004-03-18,"Oxford University Press","Jane Austen"
2157,"Tea with Jane Austen","Kim Wilson/Tom Carpenter",3.79,097212179X,9780972121798,eng,128,1442,108,2004-09-03,"Jones Books","Kim Wilson"
2166,"The Old Man and the Sea","Ernest Hemingway/Donald Sutherland",3.77,0743564367,9780743564366,eng,3,393,77,2006-05-01,"Simon Schuster Audio","Ernest Hemingway"
2167,"Cliffs Notes on Hemingway's The Old Man and the Sea","Jeanne Sallade Criswell/Gary Carey",2.83,0764586602,9780764586606,eng,80,4,0,2000-12-05,"Cliffs Notes","Jeanne Sallade Criswell"
2176,"Flaubert's Parrot","Julian Barnes",3.66,0679731369,9780679731368,eng,190,9373,606,1990-11-27,Vintage,"Julian Barnes"
2178,"Flaubert in Egypt: A Sensibility on Tour","Gustave Flaubert/Francis Steegmuller",3.62,0140435824,9780140435825,eng,230,378,31,1996-03-30,"Penguin Books (Penguin Classics)","Gustave Flaubert"
2179,"A Sentimental Education","Gustave Flaubert/Douglas Parmée",3.83,0192836226,9780192836229,eng,464,105,7,2000-05-18,"Oxford University Press","Gustave Flaubert"
2182,"Three Tales","Gustave Flaubert/Roger Whitehouse/Geoffrey Wall",3.69,0140448004,9780140448009,eng,110,3190,150,2005-01-27,"Penguin Classics","Gustave Flaubert"
2183,"Sentimental Education","Gustave Flaubert/Robert Baldick/Geoffrey Wall",3.83,0140447970,9780140447972,eng,460,13499,388,2004-02-05,"Penguin Classics","Gustave Flaubert"
2186,"The Family Idiot 5: Gustave Flaubert 1821-1857","Jean-Paul Sartre/Carol Cosman",3.8,0226735192,9780226735191,eng,632,5,1,1994-01-26,"University of Chicago Press","Jean-Paul Sartre"
2187,Middlesex,"Jeffrey Eugenides",4.0,0312422156,9780312422158,eng,529,540349,19548,2003-09-16,"Picador USA","Jeffrey Eugenides"
2199,"Team of Rivals: The Political Genius of Abraham Lincoln","Doris Kearns Goodwin",4.28,0743270754,9780743270755,eng,916,133840,6118,2006-09-26,"Simon & Schuster","Doris Kearns Goodwin"
2203,"John Adams","David McCullough",4.06,0743223136,9780743223133,eng,751,282649,5325,2001-05-22,"Simon & Schuster Paperbacks","David McCullough"
2204,"The John Adams Reader: Eseential Writings on an American Composer","Thomas May/John Adams",3.5,1574671324,9781574671322,eng,455,20,5,2006-06-01,Amadeus,"Thomas May"
2205,"The Letters of John and Abigail Adams","Abigail Adams/Frank Shuffelton",4.14,0142437115,9780142437117,eng,512,275,28,2003-12-30,"Penguin Classics","Abigail Adams"
2209,"Passionate Sage: The Character and Legacy of John Adams","Joseph J. Ellis",4.05,0393311333,9780393311334,eng,288,2622,78,2001-02-17,"W. W. Norton Company","Joseph J. Ellis"
2211,"The Portable John Adams","John Adams/John Patrick Diggins",4.17,0142437786,9780142437780,eng,533,57,0,2004-06-29,"Penguin Books","John Adams"
2218,"Sex For Dummies","Ruth Westheimer",3.65,076455302X,9780764553028,eng,432,10,0,2000-12-28,"For Dummies","Ruth Westheimer"
2219,"Baby Signing For Dummies","Jennifer Watson",3.64,0471773867,9780471773863,eng,257,37,9,2006-10-01,"John Wiley & Sons","Jennifer Watson"
2222,"The Feeling Good Handbook","David D. Burns",4.0,0452281326,9780452281325,eng,729,4797,124,1999-10-28,Penguin,"David D. Burns"
2226,"On Death and Dying","Elisabeth Kübler-Ross",4.16,0684842238,9780684842233,eng,288,144,10,1997-07-02,Scribner,"Elisabeth Kübler-Ross"
2227,"Questions and Answers on Death and Dying: A Companion Volume to On Death and Dying","Elisabeth Kübler-Ross",4.07,0684839377,9780684839370,eng,192,197,7,1997-06-09,Scribner,"Elisabeth Kübler-Ross"
2228,"The Last Dance: Encountering Death and Dying","Lynne Ann DeSpelder/Albert Lee Strickland",3.77,0072920963,9780072920963,eng,664,123,13,2004-02-06,"McGraw-Hill Humanities/Social Sciences/Languages","Lynne Ann DeSpelder"
2236,"Mahatma Gandhi and His Myths: Civil Disobedience Nonviolence and Satyagraha in the Real World (Plus Why It's Gandhi Not Ghandi)","Mark Shepard",3.62,0938497197,9780938497196,eng,46,55,7,2002-01-01,"Simple Productions","Mark Shepard"
2249,"The Seven Habits of Highly Effective People","Stephen R. Covey",4.1,0671708635,9780671708634,eng,368,2505,233,1990-09-15,"Free Press","Stephen R. Covey"
2250,"The 7 Habits of Highly Effective People Personal Workbook","Stephen R. Covey",4.24,0743250974,9780743250979,eng,192,1874,114,2004-01-06,"Simon Schuster","Stephen R. Covey"
2253,"Daily Reflections For Highly Effective People: Living the 7 Habits of Highly Successful People Every Day","Stephen R. Covey",3.9,0671887173,9780671887179,eng,384,336,26,1994-03-21,"Simon Schuster","Stephen R. Covey"
2255,"Way of the Peaceful Warrior: A Book That Changes Lives","Dan Millman",4.14,1932073205,9781932073201,eng,240,39947,1622,2006-04-13,"HJ Kramer","Dan Millman"
2257,"Secret of the Peaceful Warrior","Dan Millman/Robert D. San Souci/T. Taylor Bruce",4.15,0915811235,9780915811236,eng,32,156,13,1992-12-28,"HJ Kramer","Dan Millman"
2265,"It's Not about the Bike: My Journey Back to Life","Lance Armstrong/Sally Jenkins",3.72,0425179613,9780425179611,eng,294,35050,1833,2001-09-01,"Berkley Publishing Group","Lance Armstrong"
2267,"23 Days in July: Inside the Tour de France and Lance Armstrong's Record-Breaking Victory","John Wilcockson/Graham Watson",3.67,0306814552,9780306814556,eng,344,360,26,2005-06-15,"Da Capo Press","John Wilcockson"
2279,Truman,"David McCullough",4.12,0671869205,9780671869205,eng,1120,71764,1937,1993-06-14,"Simon Schuster","David McCullough"
2281,"The Complete Stories of Truman Capote","Truman Capote/Reynolds Price",4.2,140009691X,9781400096916,eng,320,3993,217,2005-09-13,Vintage,"Truman Capote"
2282,"Breakfast at Tiffany's: A Short Novel and Three Stories","Truman Capote",3.89,067960085X,9780679600855,eng,162,5658,699,1994-01-13,"Modern Library","Truman Capote"
2283,"Murder at The Washington Tribune (Capital Crimes #21)","Margaret Truman",3.58,0345478207,9780345478207,eng,384,585,78,2006-10-31,"Ballantine Books","Margaret Truman"
2285,"Murder at Ford's Theatre (Capital Crimes #19)","Margaret Truman",3.74,0449007383,9780449007389,eng,376,623,68,2003-09-30,Fawcett,"Margaret Truman"
2287,"Other Voices Other Rooms","Truman Capote",3.8,0679745645,9780679745648,eng,232,10635,656,1994-02-01,Vintage,"Truman Capote"
2289,"In Cold Blood","Truman Capote/Scott Brick",4.07,073933364X,9780739333648,eng,15,563,133,2006-01-03,"Random House Audio","Truman Capote"
2296,"Emergence: The Connected Lives of Ants Brains Cities and Software","Steven Johnson",3.96,0684868768,9780684868769,eng,288,2769,200,2002-09-10,Scribner,"Steven Johnson"
2299,"Emergence: Labeled Autistic","Temple Grandin/Margaret M. Scariano",4.07,0446671827,9780446671828,eng,200,1827,154,1996-09-01,"Grand Central Publishing","Temple Grandin"
2304,"The Emergence of Life on Earth: A Historical and Scientific Overview","Iris Fry",4.02,0813527406,9780813527406,eng,344,48,5,2000-02-01,"Rutgers University Press","Iris Fry"
2305,"The Ghost Stories of Edith Wharton","Edith Wharton/Laszlo Kubinyi",3.89,0684842572,9780684842578,eng,303,2842,182,1997-10-10,Scribner,"Edith Wharton"
2306,"The House of Mirth / The Reef / The Custom of the Country / The Age of Innocence","Edith Wharton/R.W.B. Lewis",4.3,0940450313,9780940450318,eng,1328,446,29,1986-05-12,"Library of America","Edith Wharton"
2307,"Collected Stories 1911-1937","Edith Wharton/Maureen Howard",4.25,1883011949,9781883011949,eng,848,55,9,2001-01-29,"Library of America","Edith Wharton"
2309,"Novellas and Other Writings: Madame de Treymes / Ethan Frome / Summer / Old New York / The Mother’s Recompense / A Backward Glance","Edith Wharton/Cynthia Griffin Wolff",4.22,0940450534,9780940450530,eng,1137,67,9,1990-04-01,"Library of America","Edith Wharton"
2314,"The House of Mirth","Edith Wharton",3.95,0486420493,9780486420493,eng,272,749,62,2002-08-06,"Dover Publications","Edith Wharton"
2315,"Below the Root","Zilpha Keatley Snyder/Alton Raible",4.08,0689304579,9780689304576,eng,231,41,9,1975-01-01,"Atheneum Books","Zilpha Keatley Snyder"
2319,"The Witches of Worm","Zilpha Keatley Snyder",3.69,0440802504,9780440802501,eng,183,40,12,1991-05-01,"Dell Yearling","Zilpha Keatley Snyder"
2322,"The Deeper Meaning of Liff","Douglas Adams/John Lloyd",3.93,0307236013,9780307236012,eng,192,3986,85,2005-04-19,"Three Rivers Press","Douglas Adams"
2326,"Dirk Gently's Holistic Detective Agency (Dirk Gently #1)","Douglas Adams",3.98,1597770078,9781597770071,eng,6,58,15,2005-09-30,"Phoenix Audio","Douglas Adams"
2327,"The Letters of J.R.R. Tolkien","J.R.R. Tolkien/Humphrey Carpenter/Christopher Tolkien",4.15,0618056998,9780618056996,eng,502,4689,171,2000-06-06,"Mariner Books","J.R.R. Tolkien"
2329,"The History of the Lord of the Rings (The History of Middle-earth #6-9)","J.R.R. Tolkien/Christopher Tolkien",4.38,0618083553,9780618083558,eng,1680,237,3,2000-09-01,"Mariner Books","J.R.R. Tolkien"
2330,"The Languages of Tolkien's Middle-Earth","Ruth S. Noel/J.R.R. Tolkien",3.98,0395291305,9780395291306,eng,207,4685,74,1980-05-28,"Houghton Mifflin Company","Ruth S. Noel"
2331,"The Lord of the Rings- 3 volumes set (The Lord of the Rings #1-3)","J.R.R. Tolkien",4.5,0618574999,9780618574995,eng,1438,232,9,2005-06-01,"Mariner Books","J.R.R. Tolkien"
2333,"Farmer Giles of Ham","J.R.R. Tolkien/Christina Scull/Wayne G. Hammond",3.85,0618009361,9780618009367,eng,127,5526,225,1999-11-15,"Houghton Mifflin Harcourt","J.R.R. Tolkien"
2336,Tandia,"Bryce Courtenay",4.05,0140272925,9780140272925,eng,905,8461,369,1998-08-31,"Penguin Books Australia Ltd.","Bryce Courtenay"
2338,"Matthew Flinders' Cat","Bryce Courtenay",3.8,0670910619,9780670910618,eng,611,2737,161,2002-12-31,Viking,"Bryce Courtenay"
2343,"Solomon's Song (The Potato Factory #3)","Bryce Courtenay",4.01,0140271570,9780140271577,eng,671,3920,132,2001-08-31,"Penguin Books Australia Ltd.","Bryce Courtenay"
2348,"An Introduction to Old Norse","E.V. Gordon/A.R. Taylor",4.1,0198111843,9780198111849,eng,412,104,7,1981-07-23,"Oxford University Press","E.V. Gordon"
2353,"Cold Counsel: Women in Old Norse Literature and Myth","Sarah M. Anderson/Karen Swenson",3.68,0815319665,9780815319665,eng,320,19,2,2002-12-21,Routledge,"Sarah M. Anderson"
2367,"Brave Companions: Portraits in History","David McCullough",3.98,0671792768,9780671792763,eng,240,3460,482,1992-11-01,"Simon Schuster","David McCullough"
2368,"Mornings on Horseback: The Story of an Extraordinary Family a Vanished Way of Life and the Unique Child Who Became Theodore Roosevelt","David McCullough",4.12,0671447548,9780671447540,eng,445,23064,1191,1982-05-12,"Simon Schuster","David McCullough"
2370,"John Adams","David McCullough",4.06,0684813637,9780684813639,eng,752,1852,285,2001-05-01,"Simon & Schuster","David McCullough"
2371,"The Johnstown Flood","David McCullough",4.11,0844662925,9780844662923,eng,302,14739,1199,1990-01-01,"Peter Smith Publisher","David McCullough"
2372,"The Path Between the Seas: The Creation of the Panama Canal 1870-1914","David McCullough",4.2,0743262131,9780743262132,eng,697,12178,1042,2004-06-01,"Simon Schuster","David McCullough"
2373,"The Bone Collector (Lincoln Rhyme #1)","Jeffery Deaver",4.19,0451188454,9780451188458,eng,528,140014,1753,1998-04-01,"Signet Book","Jeffery Deaver"
2375,"The Bone Collector's Son","Paul Yee",3.27,0761452427,9780761452423,eng,137,117,19,2004-01-01,"Two Lions","Paul Yee"
2378,"El Coleccionista De Huesos (Lincoln Rhyme #1)","Jeffery Deaver",4.19,8466305130,9788466305136,spa,640,26,2,2003-06-01,"Punto de Lectura","Jeffery Deaver"
2386,"Moby Dick","Herman Melville/William Hootkins",3.5,9626343583,9789626343586,eng,25,67,17,2005-09-01,"Naxos Audiobooks","Herman Melville"
2388,Moby-Dick,"Jan Needle/Patrick Benson/Herman Melville",3.71,0763630187,9780763630188,eng,192,161,16,2006-09-12,"Candlewick Press","Jan Needle"
2389,"Moby Dick","Herman Melville/William Hootkins",3.5,0143058096,9780143058090,eng,6,8858,885,2005-06-16,"Penguin Audio","Herman Melville"
2390,Moby-Dick,"Herman Melville/Carl F. Hovde",3.5,1593080182,9781593080181,eng,707,1260,207,2003-04-01,"Barnes Noble Classics","Herman Melville"
2400,"Herman Melville's Moby-Dick: A Routledge Study Guide and Sourcebook","Michael J. Davey/Duncan Wu",3.61,0415247713,9780415247719,eng,208,50,7,2003-09-18,Routledge,"Michael J. Davey"
2404,"Moby Dick: or The White Whale (Oxford Illustrated Classics)","Geraldine McCaughrean/Victor G. Ambrus/Herman Melville",3.82,0192781537,9780192781536,eng,104,39,5,1998-04-16,"Oxford University Press USA","Geraldine McCaughrean"
2407,"Melville's Moby Dick: An American Nekyia (Studies in Jungian Psychology by Jungian Analysts)","Edward F. Edinger",3.93,0919123708,9780919123700,eng,156,23,4,2004-04-30,"Inner City Books","Edward F. Edinger"
2409,"Moby Dick: Or the White Whale (Oxford Illustrated Classics Series)","Geraldine McCaughrean/Victor G. Ambrus/Herman Melville",3.82,019274156X,9780192741561,eng,102,6,0,1997-04-03,"Oxford University Press USA","Geraldine McCaughrean"
2411,"Melville and the politics of identity: From *King Lear* to *Moby-Dick*","Julian Markels",3.33,0252063023,9780252063022,eng,164,0,0,1993-07-01,"University of Illinois Press","Julian Markels"
2412,"Unpainted to the Last: ""Moby Dick"" and Twentieth-century American Art","Elizabeth A. Schultz",4.28,0700607420,9780700607426,eng,400,16,1,1995-10-20,"University Press of Kansas","Elizabeth A. Schultz"
2423,"Double Tap (Paul Madriani #8)","Steve Martini",3.92,0515139734,9780515139730,eng,401,2790,159,2005-12-27,"Jove Books","Steve Martini"
2430,"The List","Steve Martini",3.96,0515121495,9780515121490,eng,451,12534,141,1997-12-01,Jove,"Steve Martini"
2442,"Witches Abroad (Discworld #12; Witches #3)","Terry Pratchett",4.22,0061020613,9780061020612,eng,374,58408,1272,2002-07-30,HarperTorch,"Terry Pratchett"
2443,"The Innocents Abroad","Mark Twain/Grover Gardner",3.86,0812967054,9780812967050,eng,560,8879,693,2003-02-11,"Modern Library","Mark Twain"
2445,"Teaching English Abroad","Susan Griffith",3.57,1854583522,9781854583529,eng,576,38,6,2007-01-01,"Vacation Work Publications","Susan Griffith"
2452,"Theocritus: Select Poems: Select Poems","Theocritus/Kenneth James Dover",3.0,0862921473,9780862921477,grc,395,1,1,1991-06-01,"Bristol Classical Press",Theocritus
2473,"The Shield. Catalogue of Women. Other Fragments. (Hesiod II)","Hesiod/Glenn W. Most",4.03,0674996232,9780674996236,eng,434,33,1,2007-03-01,"Harvard University Press",Hesiod
2486,"Death and the King's Horseman","Wole Soyinka/Simon Gikandi",3.76,0393977617,9780393977615,eng,254,259,30,2002-11-05,"W. W. Norton & Company","Wole Soyinka"
2494,"The Time Machine","H.G. Wells/Patrick Parrinder/Steven McLean/Marina Warner",3.89,0141439971,9780141439976,eng,104,3094,301,2005-03-31,"Penguin Books Ltd","H.G. Wells"
2495,"The Time Machine","H.G. Wells/Cynthia Brantley Johnson/Benjamin Beard",3.89,0743487737,9780743487733,eng,150,372,36,2004-07-01,"Simon Schuster","H.G. Wells"
2499,"The Ultimate Time Machine: A Remote Viewer's Perception of Time & Predictions for the New Millennium","Joseph McMoneagle",3.59,157174102X,9781571741028,eng,275,68,6,1998-10-01,"Hampton Roads Publishing Company","Joseph McMoneagle"
2501,"The Time Machine","H.G. Wells/Melvin Burgess",3.89,0439436540,9780439436540,eng,123,284,35,2004-03-01,"Scholastic Paperbacks","H.G. Wells"
2504,"The Complete Short Stories","H.G. Wells/John R. Hammond",4.14,1842124021,9781842124024,eng,864,875,33,2001-05-01,"Orion Publishing","H.G. Wells"
2506,"Selected Stories","H.G. Wells/Ursula K. Le Guin",3.93,0812970756,9780812970753,eng,432,80,11,2004-07-13,"Modern Library","H.G. Wells"
2508,Tono-Bungay,"H.G. Wells/Edward Mendelson/Patrick Parrinder",3.42,0141441119,9780141441115,eng,414,856,111,2005-06-28,"Penguin Classics","H.G. Wells"
2519,"The Name of the Rose (Everyman's Library (Cloth))","Umberto Eco",4.12,0307264890,9780307264893,eng,560,1338,113,2006-09-26,"Everyman's Library","Umberto Eco"
2520,"In the Name of Jesus: Reflections on Christian Leadership","Henri J.M. Nouwen",4.34,0824512596,9780824512590,eng,120,8228,410,1992-10-01,Crossroad,"Henri J.M. Nouwen"
2521,"Blood Done Sign My Name: A True Story","Timothy B. Tyson",4.15,1400083117,9781400083114,eng,368,2594,403,2005-05-03,"Broadway Books","Timothy B. Tyson"
2526,Blindness,"José Saramago/Giovanni Pontiero",4.11,0156007754,9780156007757,eng,326,107455,7778,1999-10-04,"Mariner Books","José Saramago"
2527,"The Gospel According to Jesus Christ","José Saramago/Giovanni Pontiero",4.29,0156001411,9780156001410,eng,377,799,107,1994-09-28,Harcourt,"José Saramago"
2528,"All the Names","José Saramago/Margaret Jull Costa",3.89,0156010593,9780156010597,eng,245,11016,734,2001-10-05,"Mariner Books","José Saramago"
2529,"The Tale of the Unknown Island","José Saramago/Peter Sís/Margaret Jull Costa",3.89,0156013037,9780156013031,eng,64,3331,242,2000-10-05,"Mariner Books","José Saramago"
2530,"Baltasar and Blimunda","José Saramago/Giovanni Pontiero",3.92,0156005204,9780156005203,eng,346,6184,284,1998-10-16,"Mariner Books","José Saramago"
2531,"The Cave","José Saramago/Margaret Jull Costa",3.84,0156028794,9780156028790,eng,307,7649,548,2003-10-15,"Mariner Books","José Saramago"
2535,"The Stone Raft","José Saramago/Giovanni Pontiero",3.8,0156004011,9780156004015,eng,292,308,30,1996-06-14,"Mariner Books","José Saramago"
2536,"The Year of the Death of Ricardo Reis","José Saramago/Giovanni Pontiero",4.02,1860465021,9781860465024,eng,384,3826,191,1998-09-17,"Vintage Classics","José Saramago"
2538,"El hombre duplicado","José Saramago/Pilar del Río",3.89,8466312803,9788466312806,spa,380,1295,106,2004-09-01,"Punto de Lectura","José Saramago"
2539,"Ensayo sobre la lucidez","José Saramago/Pilar del Río",3.8,8466314741,9788466314749,spa,461,1744,124,2005-01-01,"Punto de Lectura","José Saramago"
2541,"La caverna","José Saramago/Pilar del Río",3.84,846630679X,9788466306799,spa,441,842,69,2003-02-01,"Punto de Lectura","José Saramago"
2542,"The History of the Siege of Lisbon","José Saramago/Giovanni Pontiero",3.81,0156006243,9780156006248,eng,314,331,62,1998-09-01,"Mariner Books","José Saramago"
2543,"Las intermitencias de la muerte","José Saramago/Pilar del Río",4.0,9587043642,9789587043648,spa,274,2862,306,2005-12-01,Alfaguara,"José Saramago"
2545,"The Treasured Writings of Kahlil Gibran","Kahlil Gibran",4.42,089009389X,9780890093894,eng,902,1432,45,2009-10-06,"Castle Books","Kahlil Gibran"
2547,"The Prophet","Kahlil Gibran/جبران خليل جبران/Jihad El",4.23,000100039X,9780001000391,eng,127,184293,5418,2010-01-01,"Rupa & Co","Kahlil Gibran"
2549,"A Tear and a Smile","Kahlil Gibran/جبران خليل جبران/H.M. Nahmad/Robert Hillyer",4.03,0394448049,9780394448046,eng,228,2094,104,1950-06-27,"Alfred A.Knopf","Kahlil Gibran"
